{
  "$schema": "https://json-schema.org/draft/2020-12/schema",
  "$id": "https://brainsnn.com/schema/layer-catalog.v1.json",
  "title": "BrainSNN Layer Catalog",
  "description": "The BrainSNN engine's layer catalog published as data: layers (nodes), a data-flow dependency graph (edges), and a versioned manifest. Generated by scripts/export-catalog.mjs.",
  "type": "object",
  "required": ["manifest", "groups", "layers", "dependencies", "coreLayerIds"],
  "additionalProperties": false,
  "properties": {
    "manifest": {
      "type": "object",
      "required": ["schemaVersion", "version", "totalLayers", "coreLayerIds", "dependencyEdges", "groups", "contentHash"],
      "additionalProperties": false,
      "properties": {
        "schemaVersion": { "type": "string", "const": "brainsnn.layer-catalog.v1" },
        "version": { "type": "string" },
        "totalLayers": { "type": "integer", "minimum": 1 },
        "coreLayerIds": { "type": "array", "items": { "type": "integer", "minimum": 1 } },
        "dependencyEdges": { "type": "integer", "minimum": 0 },
        "groups": { "type": "object", "additionalProperties": { "type": "integer", "minimum": 0 } },
        "contentHash": { "type": "string", "description": "Deterministic FNV-1a hash over layers + core ids + dependency edges." }
      }
    },
    "groups": {
      "type": "object",
      "description": "Group id → { label, color }.",
      "additionalProperties": {
        "type": "object",
        "required": ["label", "color"],
        "properties": {
          "label": { "type": "string" },
          "color": { "type": "string" }
        }
      }
    },
    "layers": {
      "type": "array",
      "description": "The layers (graph nodes).",
      "items": {
        "type": "object",
        "required": ["id", "name", "group", "blurb"],
        "additionalProperties": false,
        "properties": {
          "id": { "type": "integer", "minimum": 1 },
          "name": { "type": "string" },
          "group": { "type": "string" },
          "blurb": { "type": "string", "minLength": 1 }
        }
      }
    },
    "dependencies": {
      "type": "array",
      "description": "Data-flow edges: a layer depends on the layers whose output it consumes inside runLayerRouter. Must be acyclic.",
      "items": {
        "type": "object",
        "required": ["id", "dependsOn", "reason"],
        "additionalProperties": false,
        "properties": {
          "id": { "type": "integer", "minimum": 1 },
          "dependsOn": { "type": "array", "items": { "type": "integer", "minimum": 1 } },
          "reason": { "type": "string", "minLength": 1 }
        }
      }
    },
    "coreLayerIds": {
      "type": "array",
      "description": "The layers evaluated on every scan.",
      "items": { "type": "integer", "minimum": 1 }
    }
  }
}
