{
  "manifest": {
    "schemaVersion": "brainsnn.layer-catalog.v1",
    "version": "1.0.0",
    "totalLayers": 103,
    "coreLayerIds": [
      3,
      4,
      5,
      29,
      36,
      39,
      40,
      46,
      48,
      63,
      70,
      101,
      102,
      103
    ],
    "dependencyEdges": 6,
    "groups": {
      "view": 18,
      "firewall": 45,
      "share": 12,
      "data": 14,
      "backend": 9,
      "progression": 5
    },
    "contentHash": "smjcw2"
  },
  "groups": {
    "view": {
      "label": "3D & UX",
      "color": "#00f5ff"
    },
    "firewall": {
      "label": "Cognitive Firewall",
      "color": "#a855f7"
    },
    "share": {
      "label": "Share & Cards",
      "color": "#f97316"
    },
    "data": {
      "label": "Data & State",
      "color": "#22c55e"
    },
    "backend": {
      "label": "Backend & Agents",
      "color": "#06b6d4"
    },
    "progression": {
      "label": "Progression",
      "color": "#eab308"
    }
  },
  "layers": [
    {
      "id": 1,
      "name": "3D Brain Viewer",
      "group": "view",
      "blurb": "3D & UX layer preserved in the 103-layer engine stack."
    },
    {
      "id": 2,
      "name": "Neural Flow Grid",
      "group": "view",
      "blurb": "3D & UX layer preserved in the 103-layer engine stack."
    },
    {
      "id": 3,
      "name": "TRIBE v2 Frames",
      "group": "backend",
      "blurb": "TRIBE v2 and scenario projections mapped to the 7-region BrainSNN model."
    },
    {
      "id": 4,
      "name": "Cognitive Firewall",
      "group": "firewall",
      "blurb": "Deterministic pressure scoring across urgency, outrage, certainty, fear and trust erosion."
    },
    {
      "id": 5,
      "name": "Gemma 4 Engine",
      "group": "firewall",
      "blurb": "Gemma endpoint support for deep multimodal analysis when configured server-side."
    },
    {
      "id": 6,
      "name": "Snapshots",
      "group": "data",
      "blurb": "Data & State layer preserved in the 103-layer engine stack."
    },
    {
      "id": 7,
      "name": "Analytics Dashboard",
      "group": "data",
      "blurb": "Data & State layer preserved in the 103-layer engine stack."
    },
    {
      "id": 8,
      "name": "Narrative Engine",
      "group": "data",
      "blurb": "Data & State layer preserved in the 103-layer engine stack."
    },
    {
      "id": 9,
      "name": "Toast Notifications",
      "group": "view",
      "blurb": "3D & UX layer preserved in the 103-layer engine stack."
    },
    {
      "id": 10,
      "name": "Keyboard Shortcuts",
      "group": "view",
      "blurb": "3D & UX layer preserved in the 103-layer engine stack."
    },
    {
      "id": 11,
      "name": "Share & Embed",
      "group": "share",
      "blurb": "Share & Cards layer preserved in the 103-layer engine stack."
    },
    {
      "id": 12,
      "name": "Onboarding Walkthrough",
      "group": "view",
      "blurb": "3D & UX layer preserved in the 103-layer engine stack."
    },
    {
      "id": 13,
      "name": "Split Brain View",
      "group": "view",
      "blurb": "3D & UX layer preserved in the 103-layer engine stack."
    },
    {
      "id": 14,
      "name": "AI Voice Narrator",
      "group": "view",
      "blurb": "3D & UX layer preserved in the 103-layer engine stack."
    },
    {
      "id": 15,
      "name": "Plugin System",
      "group": "data",
      "blurb": "Data & State layer preserved in the 103-layer engine stack."
    },
    {
      "id": 16,
      "name": "Live Sync",
      "group": "share",
      "blurb": "Share & Cards layer preserved in the 103-layer engine stack."
    },
    {
      "id": 17,
      "name": "Heatmap Timeline",
      "group": "data",
      "blurb": "Data & State layer preserved in the 103-layer engine stack."
    },
    {
      "id": 18,
      "name": "Knowledge Brain",
      "group": "data",
      "blurb": "Data & State layer preserved in the 103-layer engine stack."
    },
    {
      "id": 19,
      "name": "MCP Bridge",
      "group": "backend",
      "blurb": "Backend & Agents layer preserved in the 103-layer engine stack."
    },
    {
      "id": 20,
      "name": "Code-Aware Knowledge",
      "group": "data",
      "blurb": "Data & State layer preserved in the 103-layer engine stack."
    },
    {
      "id": 21,
      "name": "Brain Steward",
      "group": "backend",
      "blurb": "Backend & Agents layer preserved in the 103-layer engine stack."
    },
    {
      "id": 22,
      "name": "Conversation Brain",
      "group": "firewall",
      "blurb": "Cognitive Firewall layer preserved in the 103-layer engine stack."
    },
    {
      "id": 23,
      "name": "Cognitive Immunity Score",
      "group": "progression",
      "blurb": "Progression layer preserved in the 103-layer engine stack."
    },
    {
      "id": 24,
      "name": "Real Embeddings",
      "group": "firewall",
      "blurb": "Cognitive Firewall layer preserved in the 103-layer engine stack."
    },
    {
      "id": 25,
      "name": "Red Team Simulator",
      "group": "firewall",
      "blurb": "Cognitive Firewall layer preserved in the 103-layer engine stack."
    },
    {
      "id": 26,
      "name": "Dream Mode",
      "group": "view",
      "blurb": "3D & UX layer preserved in the 103-layer engine stack."
    },
    {
      "id": 27,
      "name": "Adversarial Training",
      "group": "firewall",
      "blurb": "Cognitive Firewall layer preserved in the 103-layer engine stack."
    },
    {
      "id": 28,
      "name": "Neuro-RAG",
      "group": "firewall",
      "blurb": "Cognitive Firewall layer preserved in the 103-layer engine stack."
    },
    {
      "id": 29,
      "name": "Affective Decoder",
      "group": "firewall",
      "blurb": "12-affect trigger decoding across threat, reward, social and cognitive clusters."
    },
    {
      "id": 30,
      "name": "Neurochemistry Sandbox",
      "group": "firewall",
      "blurb": "Cognitive Firewall layer preserved in the 103-layer engine stack."
    },
    {
      "id": 31,
      "name": "Brain Evolve",
      "group": "firewall",
      "blurb": "Cognitive Firewall layer preserved in the 103-layer engine stack."
    },
    {
      "id": 32,
      "name": "Attack Evolve",
      "group": "firewall",
      "blurb": "Cognitive Firewall layer preserved in the 103-layer engine stack."
    },
    {
      "id": 33,
      "name": "Multimodal RAG Router",
      "group": "firewall",
      "blurb": "Cognitive Firewall layer preserved in the 103-layer engine stack."
    },
    {
      "id": 34,
      "name": "Vector-Graph Fusion",
      "group": "firewall",
      "blurb": "Cognitive Firewall layer preserved in the 103-layer engine stack."
    },
    {
      "id": 35,
      "name": "Direct Content Insertion",
      "group": "firewall",
      "blurb": "Cognitive Firewall layer preserved in the 103-layer engine stack."
    },
    {
      "id": 36,
      "name": "Autopsy Mode",
      "group": "share",
      "blurb": "Per-content autopsy and A/B battle rollups for variants and transcripts."
    },
    {
      "id": 37,
      "name": "Cognitive Fragments",
      "group": "view",
      "blurb": "3D & UX layer preserved in the 103-layer engine stack."
    },
    {
      "id": 38,
      "name": "Daily Firewall Challenge",
      "group": "progression",
      "blurb": "Progression layer preserved in the 103-layer engine stack."
    },
    {
      "id": 39,
      "name": "Propaganda Templates",
      "group": "firewall",
      "blurb": "Named manipulation and persuasion templates, surfaced as concrete evidence."
    },
    {
      "id": 40,
      "name": "Sentence Heatmap",
      "group": "firewall",
      "blurb": "Sentence-level heatmap annotation connected to recommendations."
    },
    {
      "id": 41,
      "name": "Refutation Library",
      "group": "firewall",
      "blurb": "Cognitive Firewall layer preserved in the 103-layer engine stack."
    },
    {
      "id": 42,
      "name": "Counter-Draft",
      "group": "firewall",
      "blurb": "Cognitive Firewall layer preserved in the 103-layer engine stack."
    },
    {
      "id": 43,
      "name": "Time-Series Autopsy",
      "group": "share",
      "blurb": "Share & Cards layer preserved in the 103-layer engine stack."
    },
    {
      "id": 44,
      "name": "Inbox Mode",
      "group": "share",
      "blurb": "Share & Cards layer preserved in the 103-layer engine stack."
    },
    {
      "id": 45,
      "name": "Semantic Templates",
      "group": "firewall",
      "blurb": "Cognitive Firewall layer preserved in the 103-layer engine stack."
    },
    {
      "id": 46,
      "name": "Firewall Receipts",
      "group": "share",
      "blurb": "Deterministic scan receipt for export, share links and audit trails."
    },
    {
      "id": 47,
      "name": "Diff Mode",
      "group": "share",
      "blurb": "Share & Cards layer preserved in the 103-layer engine stack."
    },
    {
      "id": 48,
      "name": "Ad Transparency",
      "group": "firewall",
      "blurb": "Ad transparency archetypes such as FOMO, proof gap and coercive scarcity."
    },
    {
      "id": 49,
      "name": "Scan Anywhere",
      "group": "share",
      "blurb": "Share & Cards layer preserved in the 103-layer engine stack."
    },
    {
      "id": 50,
      "name": "Weekly Recap",
      "group": "progression",
      "blurb": "Progression layer preserved in the 103-layer engine stack."
    },
    {
      "id": 51,
      "name": "Style Fingerprint",
      "group": "firewall",
      "blurb": "Cognitive Firewall layer preserved in the 103-layer engine stack."
    },
    {
      "id": 52,
      "name": "Multi-lingual Firewall",
      "group": "firewall",
      "blurb": "Cognitive Firewall layer preserved in the 103-layer engine stack."
    },
    {
      "id": 53,
      "name": "Echo Detector",
      "group": "firewall",
      "blurb": "Cognitive Firewall layer preserved in the 103-layer engine stack."
    },
    {
      "id": 54,